Austria, Abfahrt Garmisch 2020, Fast and Furious 9, Imelda Staunton, Ighalo, Kevin-Prince Boateng
Belgium, Brexit, WK veldrijden, Muguruza, Fast and Furious 9, Mary Higgins Clark
Czech Republic, Lil pump, Jasmina Alagič, Brexit, Dominic Thiem, Metrostav
Denmark, Brexit, Alicia Keys, Fast and Furious 9, Steven Tyler, Demi Lovato
Finland, Twitch, Muguruza, Fast and Furious 9, Long shot, Tom Hanks
France, Mary Higgins Clark, Tournoi des six Nations 2020, Fast and Furious 9, Euromillion 31 janvier 2020, Lakers – trail blazers
Germany, Kenin, Fast and Furious 9, Sarah Lombardi, Hertha gegen Schalke, Brexit
Greece, Brexit, Καλο μηνα, Νανσυ παραδεισανου, Κουδουναρησ, Fast and Furious 9
Hungary, Andorai Péter, Fast and furious 9, Kenin, Nike Vaporfly, A Dal 2020
Ireland, Margot Robbie, Lewis Capaldi, Rugby, Jodie Turner-Smith, Jim Carrey
Italy, Gervinho, Alessandro Greco, Muguruza, Fast and Furious 9, Iturbe
Netherlands, Snollebollekes, WK veldrijden, Willeke Alberti, NAC, KPN storing
Norway, Agnetesh, Cedric Soares, Nike Vaporfly, La Gomera, Alexandra Joner
Poland, Ighalo, Szybcy i wściekli 9, Whitney Houston, Szkocja, Imelda Staunton
Portugal, Velocidade Furiosa 9, Fevereiro, Ighalo, Harry Styles, Braga-Sporting
Romania, Finala Australian Open 2020, Brexit, Ilie barbulescu, CFR Cluj  FCSB, Oana Radu
Russia, Лев Лещенко, Форсаж 9, Телепорт, Британия вышла из ес, 1 февраля
Sweden, Melodifestivalen, Malou Prytz, EU, Storbritannien, Nike vaporfly
Switzerland, Garmisch, Jessica Mann, Fast and Furious 9, Claudia Norberg, Ighalo
Turkey, Aslı Bekiroğlu, Barış Manço, Antalyaspor, Hercai 30. bölüm, Hızlı ve Öfkeli 9
Ukraine, Наши котики, 1 февраля, Тихое место, Землетрясение одесса, Цемах
United Kingdom, Pound to euro, Margot Robbie, Jodie Turner-Smith, Jim Carrey, Daniel Kaluuya
India, Fast and Furious 9, LIVE match, KL Rahul, KPSC, February
Indonesia, Persib vs Melaka, Odion Ighalo, Fast and Furious 9, Surabaya banjir, Birds of Prey
Israel, Billie Eilish, Uncut Gems, Brexit, Amazon stock, Funeral
Japan, 地震, Eu離脱, 竹内結子, 大沢たかお, 犬鳴村
Malaysia, Fast and Furious 9, Odion Ighalo, Brexit, Cedric Soares, Lakers vs Trail Blazers
Philippines, Lakers vs Trail Blazers, Fast and Furious 9, Rockets vs Mavericks, Pandacan, Manila, Nets vs Bulls
Russia, Лев Лещенко, Форсаж 9, Телепорт, Британия вышла из ес, 1 февраля
Saudi Arabia, مريم حسين, بريطانيا, ختان, نايف هزازي, Fast and Furious 9
Singapore, Ighalo, Brexit, Fast and Furious 9, Lakers, Taylor Swift
South Korea, 스토브리그' 12회, 로또896회당첨번호, 확진자 정보, 코로나맵, 서장훈
Taiwan, 賴品妤, 越南, 拜天公, 玩命關頭9, 武漢肺炎症狀
Thailand, ตรวจสลาก, ตรวจหวย 1กุมภาพันธ์ 2563, ผลสลากกินแบ่ง, ลอตเตอรี่ 1 กุมภาพันธ์ 2563, ตรวจ
Turkey, Aslı Bekiroğlu, Barış Manço, Antalyaspor, Hercai 30. bölüm, Hızlı ve Öfkeli 9
Vietnam, Xổ số miền Nam thứ 7, Tuấn Khỉ bị bắt, Ighalo, Fast and Furious 9, Vietlott 6/45
Egypt, موقع دعم مصر, دعم مصر, وزارة الصحة, نتيجة الصف الاول الثانوى, Fast and Furious 9
Kenya, Cedric Soares, Victor Wanyama, Moses Kuria, Lakers vs Trail Blazers, West Ham vs Brighton
Nigeria, Cedric Soares, February, Fast and Furious 9, Epl transfer news, Transfer news bbc
South Africa, Chelsea, Odion Ighalo, Fast and Furious 9, Powerball results 31 January 2020, Stormers vs Hurricanes
Canada, My Chemical Romance, Tony Fernandez, Mary Higgins Clark, Grimes, Fast and Furious
Mexico, Rapidos y Furiosos, Atl San Luis vs Guadalajara, Atlas vs Tijuana, Rapidos y Furiosos 9, Dolittle
Argentina, Real Madrid, Uncut Gems, Jorge Rojas, Harry Styles, Nacho Piatti
Brazil, Carla Daniel, FEVEREIRO 2020, Chelsea, Mega-Sena 2230, Brasil sub-23
Chile, Rapido y Furioso 9, Lakers, Ariel Moreno, Cobresal vs colo-colo, Displasia cleidocraneal
Colombia, Yo Me Llamo, Rapido y Furioso 9, Shakira, Uber, Brexit
Australia, Adelaide Strikers, Chelsea, Ryan reynolds, Nike Vaporfly, Brexit
